============================= test session starts ==============================
platform linux -- Python 3.12.3, pytest-8.4.2, pluggy-1.6.0
rootdir: /home/masahiro/work/dom-enterprise-gateway/backend
configfile: pyproject.toml
plugins: langsmith-0.4.55, anyio-4.12.0, asyncio-0.23.8
asyncio: mode=Mode.STRICT
collected 29 items / 6 errors

==================================== ERRORS ====================================
______________ ERROR collecting app/tests/test_endpoints_admin.py ______________
ImportError while importing test module '/home/masahiro/work/dom-enterprise-gateway/backend/app/tests/test_endpoints_admin.py'.
Hint: make sure your test modules/packages have valid Python names.
Traceback:
/usr/lib/python3.12/importlib/__init__.py:90: in import_module
    return _bootstrap._gcd_import(name[level:], package, level)
           ^^^^^^^^^^^^^^^^^^^^^^^^^^^^^^^^^^^^^^^^^^^^^^^^^^^^
app/tests/test_endpoints_admin.py:7: in <module>
    from app.main import app
app/main.py:2: in <module>
    from app.api.endpoints import auth, chat, files, admin, feedback # auth, chat, files, admin, feedbackルーターをインポート
    ^^^^^^^^^^^^^^^^^^^^^^^^^^^^^^^^^^^^^^^^^^^^^^^^^^^^^^^^^^^^^^^^
app/api/endpoints/auth.py:7: in <module>
    from app.dependencies import get_auth_service
app/dependencies.py:12: in <module>
    from app.api.endpoints.auth import get_current_user
E   ImportError: cannot import name 'get_current_user' from partially initialized module 'app.api.endpoints.auth' (most likely due to a circular import) (/home/masahiro/work/dom-enterprise-gateway/backend/app/api/endpoints/auth.py)
______________ ERROR collecting app/tests/test_endpoints_auth.py _______________
ImportError while importing test module '/home/masahiro/work/dom-enterprise-gateway/backend/app/tests/test_endpoints_auth.py'.
Hint: make sure your test modules/packages have valid Python names.
Traceback:
/usr/lib/python3.12/importlib/__init__.py:90: in import_module
    return _bootstrap._gcd_import(name[level:], package, level)
           ^^^^^^^^^^^^^^^^^^^^^^^^^^^^^^^^^^^^^^^^^^^^^^^^^^^^
app/tests/test_endpoints_auth.py:6: in <module>
    from app.main import app
app/main.py:2: in <module>
    from app.api.endpoints import auth, chat, files, admin, feedback # auth, chat, files, admin, feedbackルーターをインポート
    ^^^^^^^^^^^^^^^^^^^^^^^^^^^^^^^^^^^^^^^^^^^^^^^^^^^^^^^^^^^^^^^^
app/api/endpoints/auth.py:7: in <module>
    from app.dependencies import get_auth_service
app/dependencies.py:12: in <module>
    from app.api.endpoints.auth import get_current_user
E   ImportError: cannot import name 'get_current_user' from partially initialized module 'app.api.endpoints.auth' (most likely due to a circular import) (/home/masahiro/work/dom-enterprise-gateway/backend/app/api/endpoints/auth.py)
______________ ERROR collecting app/tests/test_endpoints_chat.py _______________
ImportError while importing test module '/home/masahiro/work/dom-enterprise-gateway/backend/app/tests/test_endpoints_chat.py'.
Hint: make sure your test modules/packages have valid Python names.
Traceback:
/usr/lib/python3.12/importlib/__init__.py:90: in import_module
    return _bootstrap._gcd_import(name[level:], package, level)
           ^^^^^^^^^^^^^^^^^^^^^^^^^^^^^^^^^^^^^^^^^^^^^^^^^^^^
app/tests/test_endpoints_chat.py:8: in <module>
    from app.main import app
app/main.py:2: in <module>
    from app.api.endpoints import auth, chat, files, admin, feedback # auth, chat, files, admin, feedbackルーターをインポート
    ^^^^^^^^^^^^^^^^^^^^^^^^^^^^^^^^^^^^^^^^^^^^^^^^^^^^^^^^^^^^^^^^
app/api/endpoints/auth.py:7: in <module>
    from app.dependencies import get_auth_service
app/dependencies.py:12: in <module>
    from app.api.endpoints.auth import get_current_user
E   ImportError: cannot import name 'get_current_user' from partially initialized module 'app.api.endpoints.auth' (most likely due to a circular import) (/home/masahiro/work/dom-enterprise-gateway/backend/app/api/endpoints/auth.py)
____________ ERROR collecting app/tests/test_endpoints_feedback.py _____________
ImportError while importing test module '/home/masahiro/work/dom-enterprise-gateway/backend/app/tests/test_endpoints_feedback.py'.
Hint: make sure your test modules/packages have valid Python names.
Traceback:
/usr/lib/python3.12/importlib/__init__.py:90: in import_module
    return _bootstrap._gcd_import(name[level:], package, level)
           ^^^^^^^^^^^^^^^^^^^^^^^^^^^^^^^^^^^^^^^^^^^^^^^^^^^^
app/tests/test_endpoints_feedback.py:7: in <module>
    from app.main import app
app/main.py:2: in <module>
    from app.api.endpoints import auth, chat, files, admin, feedback # auth, chat, files, admin, feedbackルーターをインポート
    ^^^^^^^^^^^^^^^^^^^^^^^^^^^^^^^^^^^^^^^^^^^^^^^^^^^^^^^^^^^^^^^^
app/api/endpoints/auth.py:7: in <module>
    from app.dependencies import get_auth_service
app/dependencies.py:12: in <module>
    from app.api.endpoints.auth import get_current_user
E   ImportError: cannot import name 'get_current_user' from partially initialized module 'app.api.endpoints.auth' (most likely due to a circular import) (/home/masahiro/work/dom-enterprise-gateway/backend/app/api/endpoints/auth.py)
______________ ERROR collecting app/tests/test_endpoints_files.py ______________
ImportError while importing test module '/home/masahiro/work/dom-enterprise-gateway/backend/app/tests/test_endpoints_files.py'.
Hint: make sure your test modules/packages have valid Python names.
Traceback:
/usr/lib/python3.12/importlib/__init__.py:90: in import_module
    return _bootstrap._gcd_import(name[level:], package, level)
           ^^^^^^^^^^^^^^^^^^^^^^^^^^^^^^^^^^^^^^^^^^^^^^^^^^^^
app/tests/test_endpoints_files.py:7: in <module>
    from app.main import app
app/main.py:2: in <module>
    from app.api.endpoints import auth, chat, files, admin, feedback # auth, chat, files, admin, feedbackルーターをインポート
    ^^^^^^^^^^^^^^^^^^^^^^^^^^^^^^^^^^^^^^^^^^^^^^^^^^^^^^^^^^^^^^^^
app/api/endpoints/auth.py:7: in <module>
    from app.dependencies import get_auth_service
app/dependencies.py:12: in <module>
    from app.api.endpoints.auth import get_current_user
E   ImportError: cannot import name 'get_current_user' from partially initialized module 'app.api.endpoints.auth' (most likely due to a circular import) (/home/masahiro/work/dom-enterprise-gateway/backend/app/api/endpoints/auth.py)
___________________ ERROR collecting app/tests/test_main.py ____________________
ImportError while importing test module '/home/masahiro/work/dom-enterprise-gateway/backend/app/tests/test_main.py'.
Hint: make sure your test modules/packages have valid Python names.
Traceback:
/usr/lib/python3.12/importlib/__init__.py:90: in import_module
    return _bootstrap._gcd_import(name[level:], package, level)
           ^^^^^^^^^^^^^^^^^^^^^^^^^^^^^^^^^^^^^^^^^^^^^^^^^^^^
app/tests/test_main.py:2: in <module>
    from app.main import app
app/main.py:2: in <module>
    from app.api.endpoints import auth, chat, files, admin, feedback # auth, chat, files, admin, feedbackルーターをインポート
    ^^^^^^^^^^^^^^^^^^^^^^^^^^^^^^^^^^^^^^^^^^^^^^^^^^^^^^^^^^^^^^^^
app/api/endpoints/auth.py:7: in <module>
    from app.dependencies import get_auth_service
app/dependencies.py:12: in <module>
    from app.api.endpoints.auth import get_current_user
E   ImportError: cannot import name 'get_current_user' from partially initialized module 'app.api.endpoints.auth' (most likely due to a circular import) (/home/masahiro/work/dom-enterprise-gateway/backend/app/api/endpoints/auth.py)
=============================== warnings summary ===============================
app/schemas/auth.py:4
  /home/masahiro/work/dom-enterprise-gateway/backend/app/schemas/auth.py:4: PydanticDeprecatedSince20: Support for class-based `config` is deprecated, use ConfigDict instead. Deprecated in Pydantic V2.0 to be removed in V3.0. See Pydantic V2 Migration Guide at https://errors.pydantic.dev/2.12/migration/
    class AuthenticatedUser(BaseModel):

app/schemas/chat.py:15
  /home/masahiro/work/dom-enterprise-gateway/backend/app/schemas/chat.py:15: PydanticDeprecatedSince20: Support for class-based `config` is deprecated, use ConfigDict instead. Deprecated in Pydantic V2.0 to be removed in V3.0. See Pydantic V2 Migration Guide at https://errors.pydantic.dev/2.12/migration/
    class ChatMessageResponse(BaseModel):

app/schemas/chat.py:36
  /home/masahiro/work/dom-enterprise-gateway/backend/app/schemas/chat.py:36: PydanticDeprecatedSince20: Support for class-based `config` is deprecated, use ConfigDict instead. Deprecated in Pydantic V2.0 to be removed in V3.0. See Pydantic V2 Migration Guide at https://errors.pydantic.dev/2.12/migration/
    class ChatSessionResponse(BaseModel):

app/schemas/file.py:5
  /home/masahiro/work/dom-enterprise-gateway/backend/app/schemas/file.py:5: PydanticDeprecatedSince20: Support for class-based `config` is deprecated, use ConfigDict instead. Deprecated in Pydantic V2.0 to be removed in V3.0. See Pydantic V2 Migration Guide at https://errors.pydantic.dev/2.12/migration/
    class FileUploadResponse(BaseModel):

app/schemas/feedback.py:16
  /home/masahiro/work/dom-enterprise-gateway/backend/app/schemas/feedback.py:16: PydanticDeprecatedSince20: Support for class-based `config` is deprecated, use ConfigDict instead. Deprecated in Pydantic V2.0 to be removed in V3.0. See Pydantic V2 Migration Guide at https://errors.pydantic.dev/2.12/migration/
    class FeedbackResponse(BaseModel):

-- Docs: https://docs.pytest.org/en/stable/how-to/capture-warnings.html
=========================== short test summary info ============================
ERROR app/tests/test_endpoints_admin.py
ERROR app/tests/test_endpoints_auth.py
ERROR app/tests/test_endpoints_chat.py
ERROR app/tests/test_endpoints_feedback.py
ERROR app/tests/test_endpoints_files.py
ERROR app/tests/test_main.py
!!!!!!!!!!!!!!!!!!! Interrupted: 6 errors during collection !!!!!!!!!!!!!!!!!!!!
======================== 5 warnings, 6 errors in 1.36s =========================
